### ISSUE TITLE
观看YouTube的方法

### ISSUE THREAD

**Issue by liuyunbin** [racaljk/hosts#1059]
可以将 hosts 文件加入到DNS域名服务器中，即可观看YouTube视频
项目见 https://github.com/liuyunbin/dowsDNS

**Comment by WeihuaGu** [comment]
@liuyunbin 
系统ubuntu 16.04 32位
试了下出现以下错误
```
sudo python3 bin/dns.py
==========Config===========
Local_dns_server: 0.0.0.0
Local_dns_port: 53
Remote_dns_server: 114.114.114.114
Remote_dns_port: 53
===========Config==========
Trying start bind local IP and port ...

Binding failed! Please run as administrator，

And check the local IP address and port is correct?

==========Error message==========
CRITICAL:root:[Errno 98] Address already in use
```
又试了下dowsnature/dowsDNS的
```
sudo python2 run.py
==========Config===========
Local_dns_server: 127.0.0.1
Local_dns_port: 53
Remote_dns_server: 114.114.114.114
Remote_dns_port: 53
===========Config==========
Trying start bind local IP and port ...
Bind successfully! Running ...
```
脚本显示成功，然后没发挥作用,ping什么网站都ping 不通了

**Comment by liuyunbin** [comment]
系统的53号端口号已被占用，你可以将 dowsDNS/conf/config.json 的 Local_dns_server 改为 127.0.0.1，然后将DNS域名服务器改为 127.0.0.1 ，重启网络服务， 试一下

**Comment by WeihuaGu** [comment]
@liuyunbin 感谢你的解答。
按照你说的把Local_dns_server 改为 127.0.0.1后Bind successfully! Running ...
dns 域名服务器改为127.0.0.1 后，重启网络，还是ping什么网站都ping通.
tcpdump过滤 udp 53端口如下（192.168.16.163 是我的本机ip）
```
sudo tcpdump udp port 53
tcpdump: verbose output suppressed, use -v or -vv for full protocol decode
listening on enp2s0, link-type EN10MB (Ethernet), capture size 262144 bytes
12:11:46.868826 IP 192.168.16.163.36803 > localhost.domain: 24116+ A? www.baidu.com. (31)
12:11:46.869491 IP 192.168.16.163.36803 > localhost.domain: 25336+ PTR? 163.16.168.192.in-addr.arpa. (45)
12:11:46.869520 IP 192.168.16.163.36803 > localhost.domain: 10657+ AAAA? www.baidu.com. (31)
12:11:46.894700 IP 192.168.16.163.36803 > localhost.domain: 52108+ A? www.baidu.com. (31)
12:11:49.348466 IP 192.168.16.163.36803 > localhost.domain: 58666+ A? baidu.com. (27)
12:11:51.872673 IP 192.168.16.163.36803 > localhost.domain: 24116+ A? www.baidu.com. (31)
12:11:51.872697 IP 192.168.16.163.36803 > localhost.domain: 10657+ AAAA? www.baidu.com. (31)
```

**Comment by liuyunbin** [comment]
可能防火墙禁止了该服务，你可以在浏览器上试一下 https://www.youtube.com/watch?v=ml1XicWBtpI&t=193s 看视频能否播放
